{
  "$schema": "https://json-schema.org/draft/2020-12/schema",
  "title": "cut-motion Caption Review Plan",
  "type": "object",
  "required": ["schemaVersion", "status", "wordingAuthority", "transcriptRevision", "transcriptSha256", "timingAuthority", "segmentationAuthority", "rules", "exceptions", "cues"],
  "properties": {
    "schemaVersion": { "const": "1.0.0" },
    "status": { "enum": ["proposed", "approved"] },
    "wordingAuthority": { "const": "state/transcript.json" },
    "transcriptRevision": { "type": "integer", "minimum": 1 },
    "transcriptSha256": { "type": "string", "pattern": "^[a-f0-9]{64}$" },
    "timingAuthority": { "const": "state/transcript.json word ranges" },
    "segmentationAuthority": { "enum": ["ChatCut source segment boundaries", "agent-authored word ranges"] },
    "rules": { "type": "object" },
    "exceptions": { "type": "object" },
    "cues": {
      "type": "array",
      "minItems": 1,
      "items": {
        "type": "object",
        "required": ["id", "text", "startWordId", "endWordId"],
        "properties": {
          "id": { "type": "string", "pattern": "^caption-[0-9]{4}$" },
          "text": { "type": "string", "minLength": 1 },
          "startWordId": { "type": "string", "pattern": "^.+:word-[0-9]{3}$" },
          "endWordId": { "type": "string", "pattern": "^.+:word-[0-9]{3}$" },
          "fitFontSizePx": { "type": "number", "minimum": 1 }
        },
        "additionalProperties": false
      }
    }
  },
  "additionalProperties": false
}
