{
  "schemaVersion": "1.0.0",
  "status": "proposed",
  "wordingAuthority": "state/transcript.json",
  "transcriptRevision": 1,
  "transcriptSha256": "8f20918cb83f012f107b0a061919a08254acfb1591ee84f4988d0bf98359e0ba",
  "timingAuthority": "state/transcript.json word ranges",
  "segmentationAuthority": "agent-authored word ranges",
  "rules": {
    "exactlyOneLine": true,
    "minimumDurationSeconds": 0.5,
    "targetDurationSeconds": [0.8, 2.5],
    "targetDisplayUnits": [4, 10],
    "maximumDisplayUnits": 10,
    "fitFontSizePx": [88, 96],
    "protectedTerms": [],
    "forbiddenStandaloneCues": ["的", "了"]
  },
  "exceptions": {},
  "cues": [
    {
      "id": "caption-0001",
      "text": "看看这些特效",
      "startWordId": "seg-001:word-001",
      "endWordId": "seg-001:word-003"
    },
    {
      "id": "caption-0002",
      "text": "看看这些动画",
      "startWordId": "seg-002:word-001",
      "endWordId": "seg-002:word-003"
    }
  ]
}
